{
  "contractVersion": 1,
  "correlation": { "requestId": "request-1", "userId": "user-1", "sessionId": "session-1" },
  "toolCallId": "call-1",
  "status": "success",
  "payload": {
    "siteId": "local-fixture",
    "operationId": "1234567890abcdef12345678",
    "mapVersion": "map-version-1",
    "resultKind": "product_results",
    "records": [{ "id": "p1", "name": "Fixture headphones", "priceAmount": 99, "currency": "USD" }],
    "sources": [{ "sourceId": "source-1", "title": "Local fixture", "url": "http://localhost:8765/api/products" }],
    "retrievedAt": "2026-08-24T10:00:00+08:00",
    "staleAfter": "2026-08-24T10:05:00+08:00",
    "warnings": [],
    "redacted": false,
    "truncated": false,
    "untrusted": true
  },
  "sensitivity": { "sensitive": false, "confirmationRequired": false }
}
